{
  "batch_id": "4807bae0-9eec-5e99-9072-941143580ed9",
  "batch_report_id": "sha256:fdc704e575ae03f4027f628a331ded8fd2991b190249eb4f9a654fa6b9167a4c",
  "completed_at": "2026-09-23T03:27:05.395097Z",
  "configuration": {
    "task_ids": [
      "588634b5-e038-51ce-97f1-591206578543",
      "be1209e7-2c69-5a35-9546-7b30cdf54336",
      "c3e9a699-713c-5828-b931-afc92ed8ac5c"
    ],
    "worker_timeout_seconds": 30.0,
    "workers": 3
  },
  "schema_version": "bootstrap-worker-batch-v1",
  "started_at": "2026-09-23T03:27:05.332797Z",
  "summary": {
    "completed_tasks": 3,
    "failed_tasks": 0,
    "requested_tasks": 3,
    "transitions": 6,
    "wall_seconds": 0.062290500034578145,
    "worker_cpu_seconds": 0.0018770000000000037
  },
  "tasks": [
    {
      "cpu_seconds": 0.0006200000000000025,
      "exit_code": 0,
      "message": "bootstrap simulation completed",
      "output": {
        "act_completed": true,
        "action_id": "preserve_hp",
        "bootstrap_utility": 1.0,
        "continuation_policy_id": "public-progress-bootstrap-v1",
        "final_act": 2,
        "final_floor": 20,
        "final_gold": 120,
        "final_hp": 70,
        "final_max_hp": 80,
        "final_potion_count": 1,
        "final_relic_count": 0,
        "final_state_hash": "a5062cf6e8d120fc7616ba3bd6d8203288d64ba16365a2f9044cb0099de6dffa",
        "maximum_floor": 20,
        "method": "paired-public-progress-rollout-v1",
        "patch_id": "tactical-handoff-mock-v1",
        "ruleset_manifest_id": "sha256:509d276edaa76b4ee19e777063bf41871f8848b0e69f5b37a428d5c967d08719",
        "simulation_seed": 8597942239362006943,
        "source_act": 2,
        "source_floor": 20,
        "source_state_hash": "b23627f1d615608bdbc7e386223fa54dee22d14358a6732de01d77f56b3304ff",
        "terminal": true,
        "terminal_reward": 1.0,
        "transitions": 2,
        "truncated": false,
        "victory": true
      },
      "request_path": "tasks/588634b5-e038-51ce-97f1-591206578543/request.json",
      "request_sha256": "0697eb62af8f3de81d86f036bd9572dfa8ae74b48f98f8a702ff47552b7217ba",
      "result_path": "tasks/588634b5-e038-51ce-97f1-591206578543/result.json",
      "result_sha256": "1aa1018844156e7530016e83fcd1b59c2070e963ae6ce23156a73584f93b095e",
      "status": "completed",
      "task_id": "588634b5-e038-51ce-97f1-591206578543",
      "wall_seconds": 0.000621416955254972,
      "worker_pid": 39384
    },
    {
      "cpu_seconds": 0.0006239999999999996,
      "exit_code": 0,
      "message": "bootstrap simulation completed",
      "output": {
        "act_completed": true,
        "action_id": "spend_potion_for_relic",
        "bootstrap_utility": 1.0,
        "continuation_policy_id": "public-progress-bootstrap-v1",
        "final_act": 2,
        "final_floor": 20,
        "final_gold": 120,
        "final_hp": 60,
        "final_max_hp": 80,
        "final_potion_count": 0,
        "final_relic_count": 1,
        "final_state_hash": "aa15d3f7204a331cd0e4124f818458335d981ab32b0676a52ceb03e6cdc24c0a",
        "maximum_floor": 20,
        "method": "paired-public-progress-rollout-v1",
        "patch_id": "tactical-handoff-mock-v1",
        "ruleset_manifest_id": "sha256:509d276edaa76b4ee19e777063bf41871f8848b0e69f5b37a428d5c967d08719",
        "simulation_seed": 8597942239362006943,
        "source_act": 2,
        "source_floor": 20,
        "source_state_hash": "b23627f1d615608bdbc7e386223fa54dee22d14358a6732de01d77f56b3304ff",
        "terminal": true,
        "terminal_reward": 1.0,
        "transitions": 2,
        "truncated": false,
        "victory": true
      },
      "request_path": "tasks/be1209e7-2c69-5a35-9546-7b30cdf54336/request.json",
      "request_sha256": "44b74d7777db848c4f58799e930bc9fd5178782095e1c25ccf0a8412d1eda25d",
      "result_path": "tasks/be1209e7-2c69-5a35-9546-7b30cdf54336/result.json",
      "result_sha256": "69c7a2e2c7b8027b417b4064be63731bcbf5b3b3c983f8e6f7fe635840047086",
      "status": "completed",
      "task_id": "be1209e7-2c69-5a35-9546-7b30cdf54336",
      "wall_seconds": 0.0006251250160858035,
      "worker_pid": 39386
    },
    {
      "cpu_seconds": 0.0006330000000000016,
      "exit_code": 0,
      "message": "bootstrap simulation completed",
      "output": {
        "act_completed": true,
        "action_id": "take_damage_for_power",
        "bootstrap_utility": 1.0,
        "continuation_policy_id": "public-progress-bootstrap-v1",
        "final_act": 2,
        "final_floor": 20,
        "final_gold": 120,
        "final_hp": 42,
        "final_max_hp": 80,
        "final_potion_count": 1,
        "final_relic_count": 0,
        "final_state_hash": "0e39d9fcf49423aeebb0fdf6c4be7563d95c5ad86756fe6c6367a21644946161",
        "maximum_floor": 20,
        "method": "paired-public-progress-rollout-v1",
        "patch_id": "tactical-handoff-mock-v1",
        "ruleset_manifest_id": "sha256:509d276edaa76b4ee19e777063bf41871f8848b0e69f5b37a428d5c967d08719",
        "simulation_seed": 8597942239362006943,
        "source_act": 2,
        "source_floor": 20,
        "source_state_hash": "b23627f1d615608bdbc7e386223fa54dee22d14358a6732de01d77f56b3304ff",
        "terminal": true,
        "terminal_reward": 1.0,
        "transitions": 2,
        "truncated": false,
        "victory": true
      },
      "request_path": "tasks/c3e9a699-713c-5828-b931-afc92ed8ac5c/request.json",
      "request_sha256": "ddea44b32c33edaf547db113a3bca2211e2cb58383f2dcef427896f5e47643d4",
      "result_path": "tasks/c3e9a699-713c-5828-b931-afc92ed8ac5c/result.json",
      "result_sha256": "4053f7614c90209a44ac23fce34747b77b105eb94d6ac9f020b84e98f62dd96f",
      "status": "completed",
      "task_id": "c3e9a699-713c-5828-b931-afc92ed8ac5c",
      "wall_seconds": 0.0006347500020638108,
      "worker_pid": 39385
    }
  ]
}
